Question,Answer
1. What is a correlation coefficient value of 0 indicating?,"According to the provided context, a correlation coefficient value of 0 indicates ""no linear relationship"" between the two variables."
2. Which of the following is NOT a use of correlation in statistics?,"I don't know. The text does not mention any specific use of correlation that is not listed, so I cannot identify one that is not a use of correlation in statistics."
3. What is the range of correlation coefficient values?,"According to the text, the range of correlation coefficient values is from -1 to 1. A value of 0 indicates no linear relationship between the two variables, a value of 1 indicates a perfect positive linear relationship, and a value of -1 indicates a perfect negative linear relationship."
4. What does a correlation coefficient value of 1 indicate?,A correlation coefficient value of 1 indicates a perfect positive linear relationship between the two variables.
5. How can correlation be used in public health campaigns to discourage smoking?,"According to the text, a medical researcher might use correlation to identify the relationship between smoking and lung cancer. This information could be used to develop public health campaigns to discourage smoking."
6. What is the importance of correlation in statistics?,"According to the provided context, the importance of correlation in statistics is that it can be used:

1. To identify relationships between variables.
2. To make predictions.
3. To develop causal models.

Correlation is a powerful statistical tool that can be applied in various fields such as business, finance, medicine, and psychology to make better decisions and improve outcomes."
"7. Discuss the role of correlation in identifying relationships between variables. Provide examples from different fields (e.g., public health, psychology).","According to the provided context, correlation plays a crucial role in identifying relationships between variables. It can be used to:

* Identify whether there is a relationship between two variables and if so, whether it's positive or negative.
* Understand the relationships between different factors in a complex system.

Examples from different fields include:

* Public health: Correlation can be used to identify the relationship between smoking and lung cancer, which could inform public health campaigns to discourage smoking.
* Psychology: Correlation can be used to identify the relationship between anxiety and depression, which could lead to developing more effective treatments for these conditions.

Overall, correlation is a powerful statistical tool that helps us understand how different variables are related, making it useful in various fields."
"8. How does correlation differ from causality? Provide an example where correlation is used to identify a relationship, but not necessarily cause-and-effect.","According to the provided context, correlation differs from causality in that just because two variables are correlated, it doesn't mean that one variable causes the other. Correlation only shows the extent to which two variables are linearly related.

An example of this is given in the conclusion: there is a strong correlation between ice cream sales and shark attacks, but eating ice cream does not cause shark attacks. Instead, there is likely a third variable (hot weather) that causes both ice cream sales and shark attacks to increase."
"9. Describe how correlation can be used to make predictions and develop causal models. Provide an example of how this might be applied in a real-world scenario (e.g., public health, medicine).","According to the provided context, correlation can be used to make predictions by identifying strong correlations between two variables. If there is a strong positive or negative correlation between two variables, it is possible to use the value of one variable to predict the value of the other variable.

For example, in public health, correlation could be used to identify the relationship between smoking and lung cancer. This information could be used to develop public health campaigns to discourage smoking, which would ultimately reduce the incidence of lung cancer.

In terms of developing causal models, correlation can be used as a starting point for identifying relationships between variables. By analyzing the strength and direction of these correlations, researchers can begin to build causal models that describe how changes in one variable cause changes in other variables.

For instance, in medicine, correlation could be used to identify the relationship between risk factors (e.g., diet, exercise) and the development of certain diseases (e.g., heart disease). This information could be used to develop interventions aimed at reducing the risk of these diseases by modifying the identified risk factors."
"These refined questions aim to better reflect the context provided, focusing on the applications of correlation in different fields and scenarios, including public health campaigns.","I don't know. The question is not clear or specific enough for me to provide a helpful answer. However, based on the context provided, it seems that the question is asking about the applications of correlation in different fields and scenarios, including public health campaigns.

If you could rephrase the question or provide more context, I would be happy to try and help you with your query."
